tweet_id,check_worthiness,tweet_text,MISTRAL_7B_INSTRUCT_prediction,MIXTRAL_INSTRUCT_prediction,LORA_prediction
1234964653014384644,1,"Since this will never get reported by the media, I wanted to share a copy of this check.  @realDonaldTrump  is once again donating his salary back to the United States Government  — This quarter, it will be donated to  @HHSGov  to confront, contain, and combat #Coronavirus. Flag of United StatesFlag of United States",0.0,0.0,0.0
1236839326916341760,1,"I don't know who needs to hear this but Alberta just added COVID19 testing to ALL respiratory swabs done in ER or hospital. So if you're looking for flu, you'll also get an answer on #covid19. Should be #StandardOfCare IMHO.",0.0,0.0,0.0
1236843649775947776,1,Here are some of the other people who may have been in the green room on Thursday afternoon at the same time as the CPAC #coronavirus infectee: - Rep Louie Gohmert; - Ronna McDaniel - Michael Knowles - Kay James - KellyAnne Conway - Betsy Devos - Rep Matt Gaetz - Diamond/Silk,0.0,0.0,0.0
1237562584477265920,1,"I mainly shared this story because I want people to know how difficult it is to even get tested for #COVID19 in Missouri right now. With such a narrow group of people being tested, can really know the extent of the outbreak? The current system seems pretty foolish.",0.0,0.0,0.0
1237003634036129793,1,Doctor who treated first US case of #coronavirus says patients with mild symptoms can recover at home https://t.co/ZYTWx7IG4y,0.0,0.0,0.0
1237192137751449600,1,"Hanbin worked with the same business group that helped him to get masks for COVID-19 to volunteer at a children's center last year, where they held Christmas parties and he dressed up as Santa.. (im not crying)",0.0,0.0,0.0
1240676575168921600,1,"So, the last week I have been battling COVID-19 &amp; Pneumonia. Never in my life have I been this ill. “Young people aren’t at risk, they’ll only have mild symptoms” Wrong. I want to open up about the difficulties I’ve gone through these past days, what it was like in the ICU...",0.0,0.0,0.0
1241587305644724225,1,Maddow - the woman who has peddled lies and wild conspiracy theories for 4 years - is calling on Trump to stop his COVID-19 pressers 🤦🏿‍♂️ Zero self-awareness. https://t.co/7uQy3k3IfF,0.0,0.0,0.0
1235760802851778560,1,Korea: giving free test kit for covid-19  PH: we on tiktok!!! 🥰,0.0,0.0,0.0
1235876564761374720,1,"hakyeon: ive donated money toward overcoming the pandemic covid-19 k0reaboo: it is unclear if “hakyeon”, who is allegedly a member of “vixx”, is reffering to the struggles of life when using the words “overcome”. we’re not sure at this time if “money” is a metaphor",0.0,0.0,0.0
1358119265774280709,1,#COVID19 vaccines are safe for people living with HIV! Find out about COVID-19 vaccines and HIV here 👇🏾,0.0,0.0,0.0
1366780368318312449,1,"Unusual swelling caused by Covid-19 vaccines is being picked up on routine mammograms and other scans, radiologists say. Here's what you can do to avoid unnecessary worries about breast and other forms of cancer when you get your vaccination. https://t.co/BxXbkaAaib",0.0,0.0,0.0
1236473220783636481,1,"THREAD: On #Coronavirus, we may be entering a period of accelerating cases. The country could look very different over next two weeks. We’ll get through this, but need to take steps now to limit the scope and impact of virus. There are things we can do now to help ourselves. 1/n",0.0,0.0,0.0
1236937893798707201,1,"I wanted detailed Covid-19 data, but had a hard time finding numbers without accompanying media bias. I collected it myself, and am sharing here. In this thread: - Incubation Time - Symptom Occurrence - Transmission Rates - First 20 US cases by date and location (cont'd)",0.0,0.0,0.0
1237324168334581760,1,"There are so many amazing aspects to this starting with fact that Nigel Farage was with Ted Cruz 3 days ago. Who has now self-isolated. It might not be only disinformation he’s spreading there, @bbc https://t.co/pUY3jTRnwF",0.0,0.0,0.0
1237269456319021056,1,"Quite something to hear UK broadcasters describing the Lombardy crisis as so dire that patients are being treated in hospital corridors. This, of course, is an NHS norm - irrespective of #COVID19. The inevitable consequence of a decade of deliberate underfunding. And so wrong 😔",0.0,0.0,0.0
1236700488172810240,1,"After months of spreading, COVID-19 has killed 3,663 people, the majority of whom have been very old with pre-existing conditions. There are many worse diseases killing many more every day that we just ""co-exist with"" and accept. WHY must we shut down the planet over THIS one?",0.0,0.0,0.0
1242476408896507910,1,"My fellow citizens, THERE IS ABSOLUTELY NO NEED TO PANIC. Essential commodities, medicines etc. would be available. Centre and various state governments will work in close coordination to ensure this. Together, we will fight COVID-19 and create a healthier India. Jai Hind!",0.0,0.0,0.0
1242397688961753088,1,"If U love humanity, then pl stop forwarding any fake msg abt #Hantavirus to avoid panic, when we already hv enough to fight wid #Coronavirus. Hanta Virus spreads only from an infected animal's urine,faeces or saliva. Pl educate yourself &amp; RT for others to understand. #NoFakeNews https://t.co/VinNLLq89y",0.0,0.0,0.0
1235714668833828864,1,"This #coronavirus emergency response package gives our government the resources it needs to confront this public health crisis – without stealing a dime from other critical initiatives. With my signature, it goes to the President’s desk. https://t.co/stxLFdcdcj",0.0,0.0,0.0
1235985070009221120,1,"NURTW Lagos is already sensitizing their people on #COVID19, sharing Hand Sanitizers etc ...... While some very “Educated” ones are spreading Fake News and doubting the patient.  NURTW 1 - Dem Dem 0  #Covid19Lagos https://t.co/QcJuHt6pA3",0.0,0.0,0.0
1235949483038474240,1,#CoronavirusInSA Who? Corona? No no no that One fake From China https://t.co/u0thoVpArn,0.0,0.0,0.0
1235445761195696131,1,"We are eight weeks into this #COVID19 outbreak: yet we have identified the virus, we have the genetic sequence, PCR & serological assay in use. This wealth of knowledge is unprecedented for a new disease.  #coronavirus <link>",0.0,0.0,0.0
1237532838930477057,1,"why the western countries failed in this situation. every countries thought it wasn’t that serious and then boom so proud of taiwan, you did really well and deserve worldwide support. #COVID19 #Corona https://t.co/6Y8ibbPqzJ",0.0,0.0,0.0
1236675730496339969,1,"Hospital Sungai Buloh will soon to be COVID-19 centre. May this effort be a paradigm for a better precaution to all Malaysians. We're arranging beds 100% for COVID-19 patients, &amp; re-distributing in-House patients to other Tertiary Hospital/District Hosp for continuation of care.",0.0,0.0,0.0
1236790504249057280,1,.@SenSchumer &amp; I are demanding that the Trump Administration prioritize the health and safety of American workers and their families over corporate interests. #coronavirus https://t.co/S8TuwaHQeM,0.0,0.0,0.0
1236965493036044288,1,"Nancy Binay justifying the panicky, neurotic, alarmist in me.😁 I mean, why'd DOH raise #COVID19 level to Red, when they literally had nothing beyond BASIC info to share w/ the public? TAPOS THEY WANT US TO STAY CALM AMIDST SLOW INFO DISSEMINATION—&amp; A HIGHLY CONTAGIOUS VIRUS?🙄 https://t.co/2QQm5bspoB",0.0,0.0,0.0
1234899404282155008,1,- China failed to develop medication for Corona Virus  - Japan failed to develop medication for CoronaVirus  - US failed to develop medication for CoronaVirus  Meanwhile Hindu Mahasabha claims that Gaumutr &Gobar can fight Corona Virus  Mera Desh Badal Raha hai Aage badh raha hai,0.0,0.0,0.0
1237437567395606530,1,"corona lowering gas prices and flights, and not fuckin w my black people? God showing out",0.0,0.0,0.0
1237235176452706304,1,"We don’t yet have all the tools we need to fight COVID-19. This is an important step toward having treatments, while we also explore vaccines and diagnostics. Thanks to @wellcometrust and @mastercard for launching this effort with us. https://t.co/M8AJ3083zK",0.0,0.0,0.0
1237094706477174784,1,"Breaking: Congress prepares to shutter Capitol Hill for coronavirus, opens telework center https://t.co/dShkLVPmFO",0.0,0.0,0.0
1235967295660277761,1,"Just like all the other fake stuff they do, the COVID-19 over-hype will backfire on the Democrats.  The economy will come roaring backs with China's grip on trade weakened and Trump's high approval on handling the virus will only help.",0.0,0.0,0.0
