tweet_id,check_worthiness,tweet_text,MISTRAL_7B_INSTRUCT standard zeroshot_prediction,MISTRAL_7B_INSTRUCT standard fewshot_prediction,MISTRAL_7B_INSTRUCT CoT zeroshot_prediction,MIXTRAL_INSTRUCT standard zeroshot_prediction,MIXTRAL_INSTRUCT standard fewshot_prediction,MIXTRAL_INSTRUCT CoT zeroshot_prediction,MISTRAL_7B_INSTRUCT LORA_prediction,LLAMA2_7B_CHAT LORA_prediction
1237192137751449600,1,"Hanbin worked with the same business group that helped him to get masks for COVID-19 to volunteer at a children's center last year, where they held Christmas parties and he dressed up as Santa.. (im not crying)",0.0,0.0,0.0,0.0,0.0,0.0,0.0,0.0
1235760802851778560,1,Korea: giving free test kit for covid-19  PH: we on tiktok!!! 🥰,0.0,0.0,0.0,0.0,0.0,0.0,0.0,0.0
1242476408896507910,1,"My fellow citizens, THERE IS ABSOLUTELY NO NEED TO PANIC. Essential commodities, medicines etc. would be available. Centre and various state governments will work in close coordination to ensure this. Together, we will fight COVID-19 and create a healthier India. Jai Hind!",0.0,0.0,0.0,0.0,0.0,0.0,0.0,0.0
1237532838930477057,1,"why the western countries failed in this situation. every countries thought it wasn’t that serious and then boom so proud of taiwan, you did really well and deserve worldwide support. #COVID19 #Corona https://t.co/6Y8ibbPqzJ",0.0,0.0,0.0,0.0,0.0,0.0,0.0,0.0
1236790504249057280,1,.@SenSchumer &amp; I are demanding that the Trump Administration prioritize the health and safety of American workers and their families over corporate interests. #coronavirus https://t.co/S8TuwaHQeM,0.0,0.0,0.0,0.0,0.0,0.0,0.0,0.0
1237437567395606530,1,"corona lowering gas prices and flights, and not fuckin w my black people? God showing out",0.0,0.0,0.0,0.0,0.0,0.0,0.0,0.0
