sentence_id,Verdict,Text,MISTRAL_7B_INSTRUCT_score,MIXTRAL_INSTRUCT_score,LORA_score,MISTRAL_7B_INSTRUCT_reasoning,MIXTRAL_INSTRUCT_reasoning,LORA_reasoning
24130,0,"If you throw another 50,000 kids on the street because of cutting recklessly in troop levels, you're going to put a lot more out of work.",80.0,80.0,100,This sentence contains a factual claim about the potential impact of troop level cuts on employment. The number of kids put on the street and the number of jobs lost are quantifiable facts that can be fact-checked using publicly available information.,"This statement contains a factual claim about the potential impact of troop level cuts on employment levels. While the exact numbers are debatable, the general idea that cutting troops could lead to job loss is a check-worthy claim.",
6927,0,It would be the largest increase in government health care ever.,80.0,80.0,100,"This statement contains a factual claim about the size of an increase in government health care, which is a matter of public interest. However, without specific information about the magnitude of the increase and the context in which it is occurring, it is difficult to assign a precise score. A score of 80 is given because the claim is factual and potentially significant, but more information is needed to determine the exact size of the increase and whether it is indeed the largest one ever.","This statement is check-worthy because it is a factual claim about a historical event. The size of the increase in government health care can be verified using publicly available data, and it is salient to the general public because it pertains to government spending and healthcare, two topics of significant public interest.",
26401,0,Congress passed a paperwork reduction act.,100.0,100.0,100,"This statement is factual and salient to the general public. The Paperwork Reduction Act is a real law that was passed by Congress in 1995. It is a significant piece of legislation that affects many aspects of government and business operations, making it a common topic of public interest.","This is a factual claim that is salient to the general public. The passing of the Paperwork Reduction Act is a significant event in the United States' legislative history, and it would be important for the general public to know whether this claim is true or not. A quick google search reveals that the Paperwork Reduction Act was indeed passed by Congress in 1980, so this claim is factual.",
25808,0,"Number one, add another million children to the insured ranks through the Medicaid program.",100.0,80.0,100,This sentence contains a clear factual claim about an increase in the number of children insured through the Medicaid program. The claim can be fact-checked using publicly available data from the Centers for Medicare and Medicaid Services or other reliable sources.,"This statement is check-worthy because it makes a factual claim about the number of children added to the insured ranks through the Medicaid program. While the number 'another million' is somewhat vague, it is still a quantifiable claim that can be fact-checked using publicly available data.",
33593,0,"I want us to raise the national minimum wage, because people who live in poverty should not -- who work full-time should not still be in poverty.",85.0,100.0,100,"This sentence contains a factual claim about the current situation of people working full-time being in poverty despite the minimum wage. It also implies a call to action to raise the minimum wage, which is a policy proposal. However, the sentence does not provide specific numbers or statistics, which could increase its check-worthiness score.","This statement is check-worthy because it contains a factual claim about the relationship between the national minimum wage and poverty levels. This is a topic of significant public interest and can be fact-checked using publicly available data on poverty rates, minimum wage levels, and employment statistics.",
2389,0,"If they had a pre-existing condition, they might not be able to get coverage at all.",85.0,80.0,100,This statement contains a factual claim about insurance coverage for individuals with pre-existing conditions. It is salient to the general public as health insurance is a common topic of interest and debate. The claim can be fact-checked using publicly available information from insurance companies and regulatory bodies.,"This statement touches on the topic of pre-existing conditions and health insurance coverage, which is a factual and salient issue in the United States. However, the statement is somewhat vague and does not provide enough context to be fully check-worthy. For example, it does not specify which pre-existing conditions or which health insurance plans it is referring to. Therefore, I would give it a score of 80.",
22691,0,"Senator Richard Lugar, the Republican chairman of the Foreign Relations Committee, said that the handling of the reconstruction aid in Iraq by this administration has been incompetent.",80.0,80.0,100,"This statement contains a factual claim about the handling of reconstruction aid in Iraq by the administration, which is a matter of public interest and relevance. However, it only mentions one specific instance of incompetence, and it does not provide a quantifiable measure of the extent or impact of this incompetence. Therefore, the score is not as high as it could be with more specific and quantifiable information.","This statement is check-worthy because it is a factual claim about the handling of the reconstruction aid in Iraq by the current administration. The claim is made by a prominent figure, Senator Richard Lugar, and it is salient to the general public because it touches on the topic of the effectiveness of the government's handling of foreign aid. The statement can be fact-checked by looking at the data on the reconstruction aid in Iraq and comparing it to the standards and expectations set by the administration. The score is 80 because the claim is made by a reputable source and it touches on a salient topic, but it does not contain specific statistics or data that can be easily verified.",
2195,0,"And every health care economist that looks at it says, over time, what'll happen is the traditional Medicare system will collapse.",80.0,80.0,100,"This statement implies a factual claim about the future actions of health care economists and the potential collapse of the traditional Medicare system. However, it is important to note that this claim may be subject to interpretation and debate among experts. Additionally, the statement does not provide specific evidence or data to support the claim, which may limit the ability to fact-check it definitively using publicly available information. Therefore, a score of 80 is assigned, reflecting a moderately check-worthy claim.","This statement is check-worthy because it makes a factual claim about the future of the traditional Medicare system. While it is difficult to fact-check predictions, the claim that 'every health care economist' has made this prediction can be fact-checked by looking at statements made by health care economists in the past. Additionally, the claim that the traditional Medicare system will 'collapse' is a strong claim that would have significant consequences, making it particularly salient to the general public.",
10942,0,"He says that he's going to give you a $5,000 tax credit.",100.0,100.0,100,"This statement is checkworthy as it contains a clear factual claim about a monetary amount, which is a quantifiable fact that can be verified through publicly available information, such as tax laws or government websites.","This is a factual claim that is salient to the general public, as it involves a specific numerical amount and a tax credit, which is a matter of public interest. It can be fact-checked using publicly available information about tax laws and policies.",
9547,0,"If somebody came to you, Governor, with a plan that said, here, I want to spend $7 or $8 trillion, and then we're going to pay for it, but we can't tell you until maybe after the election how we're going to do it, you wouldn't take such a sketchy deal and neither should you, the American people, because the math doesn't add up.",95.0,80.0,100,This sentence contains a factual claim about a large sum of money ($7 or $8 trillion) and a call to action for the American people not to accept a deal without knowing how it will be paid for. The claim about the large sum of money is salient to the general public and can be fact-checked using publicly available information.,"This statement contains a factual claim about a hypothetical plan to spend a large amount of money and then pay for it at a later time. The claim is salient to the general public because it touches on government spending and budgeting, which are important issues that affect everyone. The statement also implies that the plan's proponents are being secretive about their funding plans, which is a potentially concerning fact that could be fact-checked using publicly available information.",
3769,0,"Well, I want to make sure we're not handing the health care system over to the federal government which is basically what would ultimately happen with Senator Obama's health care plan.",80.0,80.0,100,"This statement contains a factual claim about Senator Obama's health care plan and its potential implications for the federal government's role in healthcare. However, it is not a definitive statement as it is an opinion that the handing over of the healthcare system to the federal government would ultimately happen. Therefore, the score is not 100 but rather 80.",This statement is check-worthy because it makes a factual claim about a specific policy proposal by Senator Obama. The claim is salient to the general public because health care policy is a major topic of debate in the United States. The statement can be fact-checked by reviewing Senator Obama's health care plan and determining whether it would result in the federal government taking control of the health care system.,
15251,0,"To repeat myself, we have this year the opportunity, which we'll realize, to produce 800 million tons of coal - an unequaled record in the history of our country.",80.0,80.0,100,"This statement contains a factual claim about the production record of coal in the country, which is a matter of public interest and can be fact-checked using publicly available data from sources such as the US Energy Information Administration or the World Coal Association.","The claim that Russia will produce 800 million tons of coal this year is factual and would be salient to the general public. However, I cannot verify the claim without more context, such as the source of the data and the time frame for the claim.",
25069,0,"[Applause] I propose a budget -- I have proposed a budget which would increase our nation's strength, in real terms, by double that of the Soviet Union.",80.0,80.0,100,"This statement contains a factual claim about a proposed budget and a comparison to the Soviet Union's budget, which is a matter of public record and relevant to the general public.","This statement is check-worthy because it makes a factual claim about the proposed budget and its comparison to the Soviet Union's budget. However, it is not entirely clear what is meant by'real terms' and 'nation's strength', so further clarification may be needed to fully fact-check this statement.",
9275,0,"The administration brought a criminal action against the people drilling up there for oil, this massive new resource we have.",80.0,80.0,100,"This sentence contains a factual claim about a criminal action brought by the administration against people drilling for oil. However, it also includes the subjective claim 'this massive new resource we have,' which makes it not entirely check-worthy.",The statement contains a factual claim about the administration bringing a criminal action against people drilling for oil. This is check-worthy because it is a specific claim that can be fact-checked using publicly available information about legal actions taken by the administration.,
26077,0,"Now, I've got a plan with this new welfare reform law to work with the private sector, to give employees specific tax incentives to hire people off welfare, and to do some other things which will create more jobs in the private sector, at least a million, and move more people from welfare to work.",80.0,80.0,100,"The sentence contains a factual claim about the number of jobs that may be created (at least a million) and the potential impact on people from welfare to work. However, the claim is not directly verifiable as it depends on the success of the welfare reform law and the private sector's response. Therefore, the score is set at 80 to reflect the potential factual content.","The claim of creating at least a million jobs in the private sector is check-worthy because it is a factual claim that is salient to the general public. It can be fact-checked by comparing the number of jobs created during the time period when the welfare reform law was in effect to the number of jobs created in the same time period without the law. The claim of moving more people from welfare to work is also check-worthy, but less so because it is more subjective and could be difficult to define and measure precisely.",
17874,0,"And then you add to that food and wardrobe, and all the other things, and you only have a small portion going for weapons.",80.0,80.0,100,"This sentence contains a claim about the allocation of resources for food, wardrobe, and weapons. While it is factual, it is not clear what specific context or entity this claim is referring to, which may limit the publicly available information for fact-checking. However, it is salient to the general public as it touches on the topic of resource allocation and military spending.",This statement seems to be making a factual claim about the proportion of resources that are typically allocated to weapons compared to other expenses. It is possible to fact-check this claim using publicly available data on military budgets and household spending patterns.,
10094,0,It took them a long time to say this was a terrorist act by a terrorist group.,80.0,80.0,100,This sentence contains a factual claim about the time it took for an organization or individuals to label an event as a terrorist act by a terrorist group. This information is salient to the general public and can be fact-checked using publicly available news articles or official statements from law enforcement agencies or government organizations.,The sentence contains a factual claim about the time it took for a group to label an act as a terrorist act by a terrorist group. This is check-worthy because it is a factual claim that is salient to the general public and can be fact-checked using publicly available information.,
16831,0,"And when those rich corporations don't pay that tax, the average American taxpayer pays it for 'em.",85.0,80.0,100,This sentence contains a factual claim about corporations not paying their taxes and the average American taxpayer paying for it instead. This information is salient to the general public and can be fact-checked using publicly available data from tax authorities and government reports.,"This statement is check-worthy because it asserts that when corporations evade taxes, the burden falls on the average American taxpayer. This claim is factual and pertinent to the general public, as it touches on taxation and financial responsibility.",
17424,0,"Before I campaigned as a Democrat for a Republican candidate for President, I had already voted for Dwight Eisenhower to be President of the United States.",100.0,100.0,100,"This statement contains a factual claim about the person's past voting history and political affiliation, which is salient to understanding their current political position and can be fact-checked using publicly available election records.",This statement is check-worthy because it is a factual claim about the speaker's voting history. It is salient to the general public because it touches on the speaker's political affiliations and past actions.,
16763,0,Each one of those jobs would've cost the taxpayers $25 thousand.,100.0,80.0,100,"This sentence contains a clear factual claim about the cost of jobs to taxpayers, which is a matter of public interest and can be fact-checked using publicly available information.",This statement is check-worthy because it contains a factual claim about the cost of jobs to taxpayers. It is subject to fact-checking using publicly available information about government spending on jobs.,
10057,0,"Look what's happening in Syria, in Egypt, now in Libya.",80.0,80.0,100,"This sentence contains claims about current events in multiple countries, which are factual and salient to the general public. However, it is important to note that the sentence does not provide specific facts or figures, so the score is not 100.","This sentence mentions three countries in the Middle East and North Africa region, which are currently experiencing political instability and conflict. The sentence contains factual claims about these countries that are salient to the general public, and can be fact-checked using publicly available information.",
10124,0,"So my belief is that, (A), we have to enforce the laws we've already got, make sure that we're keeping guns out of the hands of criminals, those who are mentally ill. We've done a much better job in terms of background checks, but we've got more to do when it comes to enforcement.",80.0,80.0,100,"The sentence contains factual claims about enforcing laws, keeping guns out of the hands of criminals and mentally ill individuals, and improving background checks. These claims are relevant to the general public and can be fact-checked using publicly available information.","The statement contains a factual claim about the enforcement of gun laws and background checks, which are both salient and factual. However, the statement is somewhat vague and does not provide specific details about the enforcement efforts, which is why the score is not 100.",
12697,0,We are cutting off the significant items that the Cuban regime needs in order to survive.,80.0,80.0,100,"This sentence implies a factual claim about the Cuban regime and its needs to survive. However, it is not clear what specific items are being referred to, and additional information would be needed to fact-check this claim accurately. Therefore, the score is set at 80, which indicates a moderately check-worthy statement.","The claim that certain items are'significant' to the Cuban regime's survival is factual and potentially check-worthy, as it could be verified by looking at the Cuban government's budget, trade relationships, and other relevant data. However, the term'significant' is somewhat subjective, which is why the score is not 100.",
24812,0,They fought and won World War II.,100.0,100.0,100,This sentence is checkworthy as it contains a factual claim about a major historical event that is widely known and significant to the general public.,"This is a factual claim that is both salient and can be fact-checked using publicly available information. The claim that 'they fought' implies that there was a group of people who participated in World War II, and the claim that 'they won' implies that this group was victorious. Both of these claims can be fact-checked by looking at historical records and accounts of World War II.",
26341,0,"One of the people who's here with me today met a woman in the airport saying her son, Jess was able to be present at the birth of her child because of the Family Leave Law.",80.0,80.0,100,"This sentence contains a factual claim about the Family Leave Law enabling someone to be present at the birth of their child. However, it also includes a reference to an unnamed person and their son, Jess, which introduces some level of uncertainty and potential for inaccuracy. Additionally, the sentence does not provide specific details about the location or timing of the airport encounter, which could impact the verifiability of the claim.","The statement contains a factual claim about a person meeting someone in the airport and their son being present at the birth of a child due to the Family Leave Law. While the identity of the people is not disclosed, the claim is salient to the general public and can be fact-checked using publicly available information.",
3871,0,"General Petraeus invited Senator Lindsey Graham and me to attend a ceremony where 688 brave young Americans, whose enlistment had expired, were reenlisting to stay and fight for Iraqi freedom and American freedom.",85.0,80.0,100,"This sentence contains a factual claim about the number of soldiers reenlisting and their reason for doing so. It is salient to the general public as it relates to military affairs and international conflicts. However, it does not provide any specific sources or evidence to support the claim, so the score is not 100.","The statement is factual and contains a specific number of people (688) who reenlisted. However, it is not possible to verify the exact number without access to the official records of the ceremony. The statement also includes the names of two public figures, which adds to its salience. However, the statement is not as check-worthy as it could be because it is not clear whether the reenlistment was truly for 'Iraqi freedom and American freedom,' as stated, or for other reasons. Additionally, the statement is somewhat subjective because it describes the young Americans as 'brave.'",
6122,0,"So if you've got $5,000 and it's going to cost you $12,000, that's a loss for you.",100.0,80.0,100,"This sentence contains a clear factual claim: if you have $5,000 and it costs you $12,000, then you have incurred a loss of $7,000. This claim is salient to the general public as it relates to financial transactions and the concept of loss.",This statement contains a factual claim about the financial outcome of a hypothetical situation. The claim is salient to the general public as it relates to personal finances and decision-making. The statement can be fact-checked by verifying the arithmetic calculation and checking if the figures used are accurate and up-to-date.,
20324,0,"No prescription drug benefits, no drug therapy, no preventative medicines, no vision care.",80.0,80.0,100,"This sentence contains several factual claims about prescription drug benefits, drug therapy, preventative medicines, and vision care. These claims are salient to the general public as they relate to healthcare and insurance coverage. However, the sentence does not provide specific information about the scope or extent of these claims (e.g., which drugs or therapies are being referred to, what specific preventative medicines are mentioned, etc.), so the score is not 100.","This statement contains factual claims about prescription drug benefits, drug therapy, preventative medicines, and vision care. These topics are salient to the general public and can be fact-checked using publicly available information.",
10769,0,Small businesses across America will have to cut jobs and will have their taxes increase and won't be able to hire because of Senator Obama's tax policies.,80.0,80.0,100,"This sentence contains several factual claims that can be checked: 1) Small businesses across America will have to cut jobs, 2) they will have their taxes increase, and 3) they won't be able to hire. These claims can be fact-checked using publicly available information, such as economic data and tax policy records. However, it is important to note that the sentence also includes an opinionated statement about Senator Obama's tax policies being the cause of these outcomes, which may require additional context and interpretation to fully fact-check.",This statement is check-worthy because it makes a factual claim about the impact of Senator Obama's tax policies on small businesses. The claim is salient to the general public because it touches on economic issues and job creation. The statement can be fact-checked by looking at data on job creation and tax rates for small businesses before and after Senator Obama's tax policies were implemented.,
19667,0,And they said no because they got a memo from one of their political advisers saying that instead they should characterize whatever we did as big government and make sure nothing was done to aid healthcare before the '94 elections so they could make that claim.,80.0,80.0,100,"This sentence contains a factual claim about a memo being received by political advisers and the content of the memo. However, it is not clear who 'they' are and whether the memo directly influenced the outcome. Therefore, the score is not 100 but rather 80.","This sentence is check-worthy because it asserts the existence of a memo from a political adviser instructing a certain course of action. The claim is factual and pertains to the actions of a political party, which is salient to the general public. However, the exact content of the memo is not provided, so the score is not 100.",
