sentence_id,Verdict,Text,MISTRAL_7B_INSTRUCT_score,MIXTRAL_INSTRUCT_score,LORA_score,MISTRAL_7B_INSTRUCT_reasoning,MIXTRAL_INSTRUCT_reasoning,LORA_reasoning
10945,0,He would also strip away the ability of states to provide some of the regulations on insurance companies to make sure you're not excluded for pre-existing conditions or your mammograms are covered or your maternity is covered.,85.0,90.0,100,"This sentence contains factual claims about the potential removal of state regulations on insurance companies regarding pre-existing conditions, mammograms, and maternity coverage. These claims are salient to the general public as they impact healthcare access and affordability. However, the sentence does not provide specific details about which states or insurance companies are being referred to, and it does not specify the exact nature of the regulations in question. Therefore, the score is not 100 as more information would be needed to fully fact-check these claims.","This statement touches on the topic of health insurance regulations, which is a salient topic to the general public. The statement implies that the person being discussed would strip away certain regulations, which is a factual claim that can be verified using publicly available information.",
15516,0,He had two terms in the Congress.,100.0,100.0,100,This statement is factual and can be verified using publicly available information. The number of terms served by a congressperson in the United States Congress is a matter of public record.,This is a factual claim that is check-worthy because it can be verified using publicly available information about the individual's political career. It is salient to the general public because it provides context about the individual's political experience.,
15893,0,"He said, no, she has leukemia, acute leukemia, a few weeks to live.",100.0,100.0,100,"This sentence contains a clear factual claim about a serious medical condition and a prognosis, which is salient to the general public.",This statement is check-worthy because it asserts a specific medical diagnosis and prognosis for an individual. The truth of this statement can be verified by checking medical records or consulting with medical professionals.,
17909,0,"These laws are not being enforced, have not been enforced, and the public health and the air and the water are paying the price.",80.0,80.0,100,"This sentence contains a claim about the enforcement of certain laws and their impact on public health and the environment. While the sentence is somewhat vague, it can be fact-checked by researching the existence and enforcement of specific laws related to public health and the environment, as well as the available data on the health of the air, water, and overall public health in the relevant areas. However, the sentence also contains subjective elements, such as the use of the word 'paying the price,' which may require additional interpretation and context to fully assess. Therefore, the check-worthiness score is set at 80, indicating a moderately fact-checkable claim.","This statement is check-worthy because it asserts that certain laws are not being enforced, which could have a significant impact on public health and the environment. The statement is specific enough to be fact-checked using publicly available information about law enforcement and environmental health indicators.",
2826,0,"We would have to stretch out our aircraft procurement, we would have to reduce our naval construction program, we would have to reduce the uh - research and development for the Army, the Navy, the Air Force and Marines by 8 percent.",85.0,90.0,100,The sentence contains several factual claims about specific budget reductions for different military branches. These claims can be fact-checked using publicly available budget data.,"This statement contains specific numerical figures and mentions several branches of the military, making it a factual claim that is salient to the general public. It would be check-worthy to verify whether the figures mentioned are accurate and whether the reductions were actually implemented.",
6543,0,We're going to let everybody buy into the same health-care plan senators and congressmen give themselves.,80.0,80.0,100,"This statement implies a factual claim about a health care plan available to senators and congressmen, which is a matter of public interest and can be fact-checked using publicly available information.","This statement is check-worthy because it makes a factual claim about a policy proposal that, if true, would have significant implications for the general public. The claim can be fact-checked by comparing the proposed policy to the health-care plan currently available to senators and congressmen, and determining whether they are indeed the same or substantially similar.",
24957,0,And what about the mining of the harbors in Nicaragua which violated international law?,80.0,75.0,100,"This sentence contains a claim that Nicaragua's harbor mining violated international law. This is a factual claim that is salient to the general public as it involves potential breaches of international law. However, the sentence does not provide enough context or specific details to fact-check the claim definitively. Therefore, the score is 80, as the claim is likely checkworthy but requires further investigation to confirm its accuracy.","This statement is check-worthy because it asserts that the mining of the harbors in Nicaragua violated international law. This is a factual claim that is salient to the general public, as it pertains to international relations and law. However, the statement is not entirely check-worthy as it is phrased as a question, which may indicate a degree of subjectivity. Additionally, the term'mining' is somewhat vague and could benefit from further clarification.",
16270,0,"And every defense expert I know, including people in the Pentagon itself, will tell you that given the level of defense spending and the level of defense appropriations which the Congress has now approved and the president has signed, there's no way that you can do all of these things and do them well.",80.0,80.0,100,"This sentence contains a claim about what defense experts believe regarding the feasibility of certain defense projects given the current level of defense spending and appropriations. This claim can be fact-checked by identifying the specific defense experts mentioned and their positions on the issue. However, it may be challenging to obtain this information directly from publicly available sources, and thus the score is not perfect.","This statement contains a factual claim about the opinions of defense experts and the level of defense spending and appropriations. While it may be difficult to fact-check the opinions of all defense experts, it is possible to fact-check the level of defense spending and appropriations using publicly available information.",
6123,0,"Last point about Senator McCain's plan is that insurers right now, the main restrictions on what they do is primarily state law and, under Senator McCain's plan, those rules would be stripped away and you would start seeing a lot more insurance companies cherry-picking and excluding people from coverage.",85.0,80.0,100,This statement contains a factual claim about the potential impact of Senator McCain's plan on insurance companies and their ability to cherry-pick and exclude people from coverage. The claim is salient to the general public as it relates to healthcare policy and access to insurance coverage. The claim can be fact-checked using publicly available information about the proposed legislation and the regulatory environment for insurance companies.,"This statement is check-worthy because it makes a factual claim about the effects of Senator McCain's healthcare plan on insurance companies' behavior. The claim is salient to the general public because it touches on the issue of healthcare accessibility and affordability, which are important topics of public interest.",
1301,0,"And there's been no concerted effort given to the needs of those who are both poor and black, or poor and who speak a foreign language.",80.0,80.0,100,"This sentence contains a claim about the lack of effort given to the needs of certain demographic groups (poor and black, poor and foreign language speakers). While it is a factual claim, it is not easily quantifiable and would require research to determine the extent and scope of such efforts. Therefore, the score is set at 80, which indicates a moderately check-worthy statement.","This statement touches on the topic of poverty and race, which are both salient and factual topics. However, the statement is somewhat vague and does not provide specific examples, which is why the score is not 100.",
14276,0,"And in this case I'm glad we did, because if we had let sanctions work and tried to build a consensus on that, Saddam Hussein today would be in Saudi Arabia controlling the world's oil supply, and he would be there maybe with a nuclear weapon.",80.0,80.0,100,"This statement contains a factual claim about Saddam Hussein potentially controlling the world's oil supply and possibly having a nuclear weapon if sanctions had not been implemented. These claims are salient to the general public as they relate to international politics and national security. However, the statement also includes an opinionated statement about letting sanctions work and building a consensus, which lowers the score slightly.","The claim that Saddam Hussein would be in Saudi Arabia controlling the world's oil supply if sanctions had been allowed to work is check-worthy because it is a factual claim that has significant implications for global politics and economics. However, the claim that Saddam Hussein would have a nuclear weapon is more speculative and subjective, which is why the score is not higher.",
19756,0,Prime Minister Rabin gave his life because someone in his own country literally hated him for trying to bring peace.,85.0,80.0,100,"This sentence contains a factual claim about Prime Minister Rabin's death and the motive behind it. However, it is important to note that the sentence implies'someone in his own country' committed the act, which may require further investigation to determine if it is a factually accurate statement. Additionally, the sentence does not specify who exactly 'hated' Rabin, which could be an important detail for fact-checking purposes. Therefore, the score is not 100, but rather 85, as there is some level of uncertainty and potential for further fact-checking.","This statement is check-worthy because it makes a factual claim about the motivations of Yitzhak Rabin's assassin. While it is commonly believed that Rabin's assassin was motivated by his opposition to the Oslo Accords, the exact language used in this statement suggests that the assassin 'literally hated' Rabin, which is a stronger claim. It would be worthwhile to fact-check whether the assassin's motivations were in fact this strong, and whether they were based on a personal hatred of Rabin or on a more general opposition to the peace process.",
23235,0,"I am -- I have a proposal for a tax cut for all people earning less than the $200,000.",80.0,80.0,100,"This sentence contains a factual claim about a proposed tax cut and the income threshold for eligibility, which is salient to the general public.","The statement contains a factual claim about a tax cut proposal, which is salient to the general public. However, the statement does not provide enough context to fact-check, such as the specifics of the tax cut or the current tax policy. Therefore, the score is not 100.",
8009,0,"These islands are a few miles - five or six miles - off the coast of Red China, within a general harbor area and more than a hundred miles from Formosa.",80.0,100.0,100,"The sentence mentions the location of 'these islands' in relation to 'Red China' and 'Formosa'. This information can be fact-checked using publicly available maps and geographical data. However, the exact number of miles is not crucial for fact-checking purposes and may introduce some degree of uncertainty. Therefore, the score is not perfect but still relatively high.",The sentence contains a factual claim about the distance between the islands and the coast of Red China and Formosa. This is a geographical fact that can be verified using publicly available maps and geographical data.,
11075,0,"If we had done what Senator Obama wanted done in Iraq, and that was set a date for withdrawal, which General Petraeus, our chief -- chairman of our Joint Chiefs of Staff said would be a very dangerous course to take for America, then we would have had a wider war, we would have been back, Iranian influence would have increased, al Qaeda would have re- established a base.",85.0,80.0,100,"The sentence contains several factual claims that can be checked: 1) Senator Obama wanted a date for withdrawal from Iraq, 2) General Petraeus warned against this course of action, 3) Setting a withdrawal date would have led to a wider war, 4) Iranian influence would have increased, and 5) Al Qaeda would have re-established a base. These claims can be fact-checked using publicly available information, such as news articles and academic studies.","The statement contains several factual claims that are salient to the general public, such as the position of General Petraeus, the potential consequences of setting a withdrawal date in Iraq, and the potential increase of Iranian influence and al Qaeda presence. These claims can be fact-checked using publicly available information, such as news articles, reports, and statements from officials.",
27287,0,"And the kinds of budget proposals that you've put forward, when we don't ask either you or me to pay a dime more in terms of reducing the deficit, but instead we slash support for education, that's undermining our long-term competitiveness.",80.0,80.0,100,This sentence contains a factual claim about budget proposals and their impact on education and long-term competitiveness. The claim can be fact-checked using publicly available information about budget proposals and their effects on education and competitiveness.,The claim that the budget proposals slash support for education is check-worthy because it is a factual claim that could be verified using publicly available information about the budget proposals. The claim that this would undermine long-term competitiveness is subjective and not check-worthy.,
15449,0,Is there more or less unemployment in the country than there was four years ago?,85.0,90.0,100,"This sentence contains a factual claim about the unemployment rate in the country, which is a matter of public interest. The claim can be fact-checked using data from the Bureau of Labor Statistics or other reliable sources.","This statement is check-worthy because it contains a factual claim about unemployment levels in the country, which is salient to the general public and can be fact-checked using publicly available data.",
2757,0,I'll restore that $716 billion to Medicare.,100.0,80.0,100,This statement contains a clear factual claim about a specific amount of money ($716 billion) and its intended use (restoring it to Medicare). This information can be fact-checked using publicly available data from the Medicare budget and the U.S. federal budget.,This statement is check-worthy because it is a factual claim about a specific amount of money and a specific government program. It is salient to the general public because Medicare is a major source of healthcare funding for many Americans.,
17990,0,Saddam Hussein now sits in a prison cell.,100.0,100.0,100,"This statement is factual and identifies a specific person and location, making it highly checkworthy.",This is a factual claim that is salient to the general public. The check-worthiness of this statement can be confirmed by checking whether Saddam Hussein is currently in prison. This can be done by checking reliable news sources or official government statements.,
15628,0,I won the Democratic nomination in fifty-one separate contests.,100.0,80.0,100,This statement is factual and salient to the general public as it refers to a specific number of contests won by a political candidate during the Democratic nomination process. The number of contests won is a significant fact in the context of a political campaign.,This is a factual claim that is check-worthy because it involves a specific number and a political contest. The claim can be fact-checked by looking up the results of the Democratic nomination contests and verifying the number of wins for the candidate.,
3113,0,I was the first United States president to visit Japan.,100.0,100.0,100,"This statement is factual and salient to the general public as it refers to a historical fact. The claim can be fact-checked using publicly available information, such as records of presidential visits to Japan.",This is a factual claim that is easy to verify with publicly available information. The first US president to visit Japan was President Eisenhower in 1959.,
18804,0,I also intend to double the number of special forces so that we can do the job we need to do with respect fighting the terrorists around the world.,80.0,80.0,100,"This statement contains a factual claim about the intention to double the number of special forces, which is a significant military action. However, the claim about fighting terrorists around the world is subjective and could be debated, so the score is not 100.",The claim that the number of special forces will be doubled is factual and can be checked by looking at defense budgets and military statistics. It is salient to the general public because it touches on military spending and foreign policy.,
28345,0,"And under my plan, in four years, as the percentage of our gross domestic product, federal spending will be the smallest that it has been in 50 years.",80.0,90.0,100,"This statement contains a factual claim about federal spending as a percentage of GDP in four years under the speaker's plan. However, it is not clear if the claim is true or not without further investigation. Additionally, the claim only refers to a specific time frame and does not provide any context or comparison to previous years, making it less salient to the general public.","This statement is check-worthy because it makes a specific claim about the percentage of GDP that federal spending will be in four years. This is a factual claim that is salient to the general public, as it relates to the economy and government spending.",
6498,0,"Six months after he said Osama bin Laden must be caught dead or alive, this president was asked, ""Where is Osama bin Laden? """,100.0,80.0,100,"This sentence contains a factual claim about a historical event and a direct quote from a president, making it highly checkworthy.","This statement is check-worthy because it contains a factual claim about a historical event. The claim is that the president was asked about the whereabouts of Osama bin Laden six months after saying he must be caught dead or alive. This is a factual claim that can be verified using publicly available information, such as news articles or transcripts from the time period in question.",
17031,0,"In the second century of our nation's history, our forefathers developed the most productive industrial nation in the history of the globe.",80.0,80.0,100,"This sentence contains a factual claim about the second century of the United States' history and the country's industrial productivity. However, it is not clear what specific facts are being referred to, and the claim is not quantifiable without further research. Therefore, the score is set at 80, which indicates a moderately check-worthy statement.","This statement is check-worthy because it makes a factual claim about the productivity of the US industrial sector in the 19th century. While it is true that the US became a major industrial power in the 19th century, it is worth checking the productivity claim and the specific time frame mentioned.",
20005,0,Cleaning up two-thirds of the worst toxic waste dumps.,80.0,80.0,100,"This sentence contains a factual claim about cleaning up toxic waste dumps, which is a matter of public interest. The claim specifies that two-thirds of the worst toxic waste dumps are being cleaned up, providing some level of quantifiability. However, the sentence does not provide any specific information about the location or number of these dumps, which could limit the ability to fact-check the claim fully. Therefore, the score is set at 80, reflecting the presence of a factual claim that is not fully quantifiable or locatable.","This statement is check-worthy because it contains a factual claim about the cleanup of toxic waste dumps. The claim is salient to the general public because it touches on environmental issues and public health. The score is not 100 because the statement does not specify which toxic waste dumps are being referred to, and it is unclear how the cleanup process is being measured.",
1969,0,And we know where it came from: two wars that were paid for on a credit card; two tax cuts that were not paid for; and a whole bunch of programs that were not paid for; and then a massive economic crisis.,90.0,90.0,100,"This sentence contains several factual claims about the sources of government spending, including two wars, two tax cuts, and various unpaid-for programs. These claims can be fact-checked using publicly available information, such as government budget reports and economic data.","This statement contains several factual claims that are salient to the general public, such as the funding of wars, tax cuts, and programs, as well as the occurrence of an economic crisis. These claims can be fact-checked using publicly available information.",
14932,0,"Since then, he has blamed the people for inflation, OPEC, he has blamed the Federal Reserve system, he has blamed the lack of productivity of the American people, he has then accused the people of living too well and that we must share in scarcity, we must sacrifice and get used to doing with less.",80.0,85.0,100,"This sentence contains several factual claims about actions taken by a specific person (Ronald Reagan) and the reasons he blamed for inflation. These claims can be fact-checked using publicly available information, such as historical records and news articles. However, the sentence also includes subjective interpretations and opinions, which may make it difficult to assign a definitive factual truth value. Therefore, the score is set at 80, indicating a moderately check-worthy sentence.","The sentence contains several factual claims that can be fact-checked, such as whether the person has blamed inflation, OPEC, the Federal Reserve system, and the lack of productivity of the American people. The statement that the person has accused people of living too well and that they must sacrifice and get used to doing with less is also check-worthy as it can be verified by looking at the person's public statements and comparing them to economic data on living standards and consumption patterns.",
4163,0,"We sit down with Ahmadinejad, and he says, ""We're going to wipe Israel off the face of the Earth,"" and we say, ""No, you're not""?",100.0,100.0,100,This sentence contains a clear factual claim that is both salient to the general public and can be fact-checked using publicly available information. The claim is that Ahmadinejad has stated that Iran intends to 'wipe Israel off the face of the Earth'. This claim can be fact-checked by looking for reliable sources that report this statement by Ahmadinejad.,"This statement is check-worthy because it contains a factual claim about a statement made by a public figure, Mahmoud Ahmadinejad, about a geopolitical issue that is salient to the general public. The claim is easily fact-checkable using publicly available information.",
16906,0,"He has, in effect, said that he would agree with all of - he would disapprove of the vetoes that I have made, and would have added significantly to expenditures and the deficit in the federal government.",80.0,80.0,100,This sentence contains a claim about the speaker's position on the vetoes made by another individual and potential expenditures and deficit. These claims are factual and relevant to the public.,This statement is check-worthy because it attributes a specific stance to a public figure regarding the vetoes made and the federal deficit. This can be fact-checked by comparing the public figure's statements and actions to the vetoes made and the federal deficit at the time.,
15791,0,"I can think of doctors and scientists, Jonas Salk who for example discovered a vaccine which cured one of the most dread diseases we ever had.",80.0,80.0,100,"Jonas Salk is a real person who discovered the polio vaccine, which is a significant medical achievement. However, the sentence only mentions one specific example, and there might be other factual claims related to Salk or polio that could also be checked.","The statement contains a factual claim about Jonas Salk discovering a vaccine for a dread disease. However, the statement is somewhat vague about which disease is being referred to. The statement also contains a subjective claim about the vaccine curing the disease, which may not be entirely accurate as vaccines typically prevent diseases rather than curing them.",
